[
  { "canonical_asset_id": "crypto:btc-usdt", "timeframe": "1h", "time": "2026-06-06T12:00:00.000Z", "open": 66900, "high": 67120, "low": 66880, "close": 67000, "volume": 120 },
  { "canonical_asset_id": "crypto:btc-usdt", "timeframe": "1h", "time": "2026-06-06T13:00:00.000Z", "open": 67000, "high": 67370, "low": 66980, "close": 67250, "volume": 120 },
  { "canonical_asset_id": "crypto:btc-usdt", "timeframe": "1h", "time": "2026-06-06T14:00:00.000Z", "open": 67250, "high": 67620, "low": 67230, "close": 67500, "volume": 140 },
  { "canonical_asset_id": "crypto:btc-usdt", "timeframe": "1h", "time": "2026-06-06T15:00:00.000Z", "open": 67500, "high": 67520, "low": 67230, "close": 67350, "volume": 130 },
  { "canonical_asset_id": "crypto:btc-usdt", "timeframe": "1h", "time": "2026-06-06T16:00:00.000Z", "open": 67350, "high": 67720, "low": 67330, "close": 67600, "volume": 120 },
  { "canonical_asset_id": "crypto:btc-usdt", "timeframe": "1h", "time": "2026-06-06T17:00:00.000Z", "open": 67600, "high": 67970, "low": 67580, "close": 67850, "volume": 150 },
  { "canonical_asset_id": "crypto:btc-usdt", "timeframe": "1h", "time": "2026-06-06T18:00:00.000Z", "open": 67850, "high": 68120, "low": 67830, "close": 68000, "volume": 160 },
  { "canonical_asset_id": "crypto:btc-usdt", "timeframe": "1h", "time": "2026-06-06T19:00:00.000Z", "open": 68000, "high": 68020, "low": 67680, "close": 67800, "volume": 140 },
  { "canonical_asset_id": "crypto:btc-usdt", "timeframe": "1h", "time": "2026-06-06T20:00:00.000Z", "open": 67800, "high": 68220, "low": 67780, "close": 68100, "volume": 170 },
  { "canonical_asset_id": "crypto:btc-usdt", "timeframe": "1h", "time": "2026-06-06T21:00:00.000Z", "open": 68100, "high": 68520, "low": 68080, "close": 68400, "volume": 420 },
  { "canonical_asset_id": "crypto:btc-usdt", "timeframe": "1h", "time": "2026-06-06T22:00:00.000Z", "open": 68400, "high": 68420, "low": 68130, "close": 68250, "volume": 150 },
  { "canonical_asset_id": "crypto:btc-usdt", "timeframe": "1h", "time": "2026-06-06T23:00:00.000Z", "open": 68250, "high": 68270, "low": 67930, "close": 68050, "volume": 140 },
  { "canonical_asset_id": "crypto:btc-usdt", "timeframe": "1h", "time": "2026-06-07T00:00:00.000Z", "open": 68050, "high": 68070, "low": 67780, "close": 67900, "volume": 130 },
  { "canonical_asset_id": "crypto:btc-usdt", "timeframe": "1h", "time": "2026-06-07T01:00:00.000Z", "open": 67900, "high": 68270, "low": 67880, "close": 68150, "volume": 150 },
  { "canonical_asset_id": "crypto:btc-usdt", "timeframe": "1h", "time": "2026-06-07T02:00:00.000Z", "open": 68150, "high": 68570, "low": 68130, "close": 68450, "volume": 180 },
  { "canonical_asset_id": "crypto:btc-usdt", "timeframe": "1h", "time": "2026-06-07T03:00:00.000Z", "open": 68450, "high": 68820, "low": 68430, "close": 68700, "volume": 220 },
  { "canonical_asset_id": "crypto:btc-usdt", "timeframe": "1h", "time": "2026-06-07T04:00:00.000Z", "open": 68700, "high": 68720, "low": 68380, "close": 68500, "volume": 160 },
  { "canonical_asset_id": "crypto:btc-usdt", "timeframe": "1h", "time": "2026-06-07T05:00:00.000Z", "open": 68500, "high": 68520, "low": 68180, "close": 68300, "volume": 140 },
  { "canonical_asset_id": "crypto:btc-usdt", "timeframe": "1h", "time": "2026-06-07T06:00:00.000Z", "open": 68300, "high": 68540, "low": 68280, "close": 68420, "volume": 130 },
  { "canonical_asset_id": "crypto:btc-usdt", "timeframe": "1h", "time": "2026-06-07T07:00:00.000Z", "open": 68420, "high": 68720, "low": 68400, "close": 68600, "volume": 170 },
  { "canonical_asset_id": "crypto:btc-usdt", "timeframe": "1h", "time": "2026-06-07T08:00:00.000Z", "open": 68600, "high": 68620, "low": 68360, "close": 68480, "volume": 150 },
  { "canonical_asset_id": "crypto:btc-usdt", "timeframe": "1h", "time": "2026-06-07T09:00:00.000Z", "open": 68480, "high": 68500, "low": 68200, "close": 68320, "volume": 140 },
  { "canonical_asset_id": "crypto:btc-usdt", "timeframe": "1h", "time": "2026-06-07T10:00:00.000Z", "open": 68320, "high": 68340, "low": 68060, "close": 68180, "volume": 130 },
  { "canonical_asset_id": "crypto:btc-usdt", "timeframe": "1h", "time": "2026-06-07T11:00:00.000Z", "open": 68180, "high": 68420, "low": 68160, "close": 68250, "volume": 140 }
]
